{
  "design_route": "single_time_observational",
  "target_goal": "ate",
  "outcome_structure": "time_to_event",
  "target_scale": "rmst",
  "treatment_timing": "baseline",
  "censoring_status": "moderate",
  "competing_risks": false,
  "left_truncation": false,
  "recurrent_events": false,
  "proportional_hazards_plausible": false,
  "fixed_horizon_defined": true,
  "needs_cate": false,
  "needs_inference": true,
  "needs_prediction": false,
  "high_dimensional": false,
  "sample_size": 2500,
  "n_events": 420,
  "language": "either"
}
